<?xml version="1.0" encoding="UTF-8" ?>
<!DOCTYPE jxedata SYSTEM "jxedata.dtd" [
<!ENTITY % html_entities SYSTEM "html_entities.ent" >
%html_entities;
]>

<!-- 
HTML-XHTML elements categories for JXHTMLEDIT

Elements definitions:

item        = category ID
name        = category name
description = category description
-->

<jxedata version="1.0">
	<item id="1">
		<name>page composition</name>
		<description>tags that describe the main structure of a page</description>
	</item>
	<item id="2">
		<name>page elements</name>
		<description>page elements</description>
	</item>
	<item id="3">
		<name>formatting and layout</name>
		<description>tags that describe the layout and appearance of the elements on a page</description>
	</item>
	<item id="4">
		<name>lists</name>
		<description>tags for the definition of lists</description>
	</item>
	<item id="5">
		<name>forms</name>
		<description>tags to define input forms</description>
	</item>
	<item id="6">
		<name>tables</name>
		<description>tags to define table layout</description>
	</item>
	<item id="7">
		<name>scripting</name>
		<description>tags that define a script or an alternative</description>
	</item>
	<item id="8">
		<name>various</name>
		<description>various tags that not fit other categories</description>
	</item>
</jxedata>